{
  "approvedByCommit": "21d812dcb60e642036c285647571d900b57cc3a6",
  "contractVersion": "tiled-v1",
  "entries": [
    {
      "absolutePeakBytes": 670748672,
      "comparator": {
        "identity": "python-tiled-v1-oracle",
        "inferenceOnlyMedianUs": 2452927,
        "medianUs": 2597559,
        "p95Us": 2658437
      },
      "diagnosticsPeakBytes": {
        "off": 663093248,
        "on": 670748672
      },
      "inferenceOnlyMedianUs": 2422306,
      "key": {
        "bundleId": "ppocrv6-small-onnx-20260714.2",
        "contractVersion": "tiled-v1",
        "coreVersion": "0.2.0",
        "fixtureHash": "79aa3c093fe85fabc7bcd1beca07da189588fc7ba8d1b08a2d20ea109284a7a5",
        "fixtureId": "tiled-small-text-2048",
        "implementation": "core",
        "nodeVersion": null,
        "pixelHash": "576d9c14ec019f0c219021101a21a52b3f22887ad9d30105341b1af8b51a02ff",
        "platformId": "linux-x64",
        "runnerClass": {
          "logicalCpus": 4,
          "machine": "x86_64",
          "processor": "x86_64",
          "python": "3.11.15",
          "release": "6.17.0-1018-azure",
          "system": "Linux",
          "toolchain": {
            "buildType": "Release",
            "cmake": "cmake version 3.31.6",
            "compiler": "c++ (Ubuntu 13.3.0-6ubuntu2~24.04.1) 13.3.0",
            "compilerPath": "/usr/bin/c++",
            "compilerTarget": "x86_64-linux-gnu",
            "cxxFlags": {
              "common": "",
              "configuration": "-O3 -DNDEBUG"
            },
            "deploymentTarget": "",
            "generator": "Ninja",
            "linker": "GNU ld (GNU Binutils for Ubuntu) 2.42",
            "linkerFlags": {
              "common": "",
              "configuration": ""
            },
            "linkerPath": "/usr/bin/ld",
            "sdkVersion": "",
            "sysroot": "",
            "systemName": "Linux",
            "systemProcessor": "x86_64"
          },
          "totalMemoryBytes": 16765386752
        },
        "threadConfig": "ort-intra-1/inter-1"
      },
      "medianUs": 2487696,
      "p95Us": 2632035,
      "reportDigests": [
        "83986b68c57295009572e6ebfa80477601b340d4e2f903b92af45508e2727c2f",
        "9a963b527a2f9eec822f090c2654b021dff3bac0ee7a31e9947afec0a9b89e01",
        "b4c17b219ca12c6cfd723a185ba4051c46e8b42763c3a51ddacc1a112866b136",
        "03b6c79674a381e2608df8c30e0824df519f0c0d3a5e259be8cd1faa716d8caf",
        "103f1dabda516403951f3c7ac0eac62f407a4fb960420db04fdccbfd05e59e71"
      ],
      "resultHashes": [
        "cb4cce8979f6a610ed463316205a6d2633991cd3a9d9f6dfe58ad3bad0ab2ee3",
        "50b0359062b4a7fc4eea32b1b7f64b21da3cc23162b45141d4a6dfd25e85ad53"
      ],
      "samples": 10
    },
    {
      "absolutePeakBytes": 747454464,
      "comparator": {
        "absolutePeakBytes": 670748672,
        "enforced": false,
        "identity": "same-runner-core",
        "medianUs": 2487696,
        "observedMedianRatio": 0.9927961455097407,
        "observedP95Ratio": 1.013171557369108,
        "observedPeakOverheadBytes": 76705792,
        "p95Us": 2632035,
        "reason": "separate process baselines and non-interleaved samples"
      },
      "diagnosticsPeakBytes": {
        "off": 744976384,
        "on": 747454464
      },
      "inferenceOnlyMedianUs": 2395565,
      "key": {
        "bundleId": "ppocrv6-small-onnx-20260714.2",
        "contractVersion": "tiled-v1",
        "coreVersion": "0.2.0",
        "fixtureHash": "79aa3c093fe85fabc7bcd1beca07da189588fc7ba8d1b08a2d20ea109284a7a5",
        "fixtureId": "tiled-small-text-2048",
        "implementation": "node",
        "nodeVersion": "v22.23.1",
        "packageVersion": "0.2.0",
        "pixelHash": "576d9c14ec019f0c219021101a21a52b3f22887ad9d30105341b1af8b51a02ff",
        "platformId": "linux-x64",
        "runnerClass": {
          "cpu": "Intel(R) Xeon(R) 6973P-C",
          "logicalCpus": 4,
          "machine": "x64",
          "napi": "10",
          "release": "6.17.0-1018-azure",
          "system": "linux",
          "totalMemoryBytes": 16765386752
        },
        "threadConfig": "ort-intra-1/inter-1"
      },
      "medianUs": 2469775,
      "p95Us": 2666703,
      "reportDigests": [
        "a1c7eec68855f292162cb410371b144682df1ab5ce1fafddb604668339411374",
        "9e1f261f9beeb8abd7173814dcd3dd4ec577ed22ce44c15e3650af4e8705727c"
      ],
      "resultHashes": [
        "2a464c15e0bfb5eb1787b5c480141c1f359108832f6550f8bb4d3bb98c727db3"
      ],
      "samples": 10
    },
    {
      "absolutePeakBytes": 745660416,
      "comparator": {
        "absolutePeakBytes": 670748672,
        "enforced": false,
        "identity": "same-runner-core",
        "medianUs": 2487696,
        "observedMedianRatio": 0.9728423408648001,
        "observedP95Ratio": 0.9794322643885814,
        "observedPeakOverheadBytes": 74911744,
        "p95Us": 2632035,
        "reason": "separate process baselines and non-interleaved samples"
      },
      "diagnosticsPeakBytes": {
        "off": 745660416,
        "on": 740864000
      },
      "inferenceOnlyMedianUs": 2346879,
      "key": {
        "bundleId": "ppocrv6-small-onnx-20260714.2",
        "contractVersion": "tiled-v1",
        "coreVersion": "0.2.0",
        "fixtureHash": "79aa3c093fe85fabc7bcd1beca07da189588fc7ba8d1b08a2d20ea109284a7a5",
        "fixtureId": "tiled-small-text-2048",
        "implementation": "node",
        "nodeVersion": "v24.18.0",
        "packageVersion": "0.2.0",
        "pixelHash": "576d9c14ec019f0c219021101a21a52b3f22887ad9d30105341b1af8b51a02ff",
        "platformId": "linux-x64",
        "runnerClass": {
          "cpu": "Intel(R) Xeon(R) 6973P-C",
          "logicalCpus": 4,
          "machine": "x64",
          "napi": "10",
          "release": "6.17.0-1018-azure",
          "system": "linux",
          "totalMemoryBytes": 16765386752
        },
        "threadConfig": "ort-intra-1/inter-1"
      },
      "medianUs": 2420136,
      "p95Us": 2577900,
      "reportDigests": [
        "0648683b0aeca46bfddf595c6d445acd79dc146661bafb5929552c3a5452b69d",
        "86d15aa06bd14cfa7ef94f08a2b2e01356acaf747e43e8b4438e2b5488badb44"
      ],
      "resultHashes": [
        "2a464c15e0bfb5eb1787b5c480141c1f359108832f6550f8bb4d3bb98c727db3"
      ],
      "samples": 10
    },
    {
      "absolutePeakBytes": 663363584,
      "comparator": {
        "identity": "python-tiled-v1-oracle",
        "inferenceOnlyMedianUs": 3490401,
        "medianUs": 3691084,
        "p95Us": 3963818
      },
      "diagnosticsPeakBytes": {
        "off": 663363584,
        "on": 661254144
      },
      "inferenceOnlyMedianUs": 3381737,
      "key": {
        "bundleId": "ppocrv6-small-onnx-20260714.2",
        "contractVersion": "tiled-v1",
        "coreVersion": "0.2.0",
        "fixtureHash": "d5497796ca117c104d504d720d93b3cd8821f4700d7b384f7210334fe313236f",
        "fixtureId": "tiled-dense-2048",
        "implementation": "core",
        "nodeVersion": null,
        "pixelHash": "695d947c97b67687ee66e79c1d3433836422fce89a974e0a1d72fae62af38e8f",
        "platformId": "linux-x64",
        "runnerClass": {
          "logicalCpus": 4,
          "machine": "x86_64",
          "processor": "x86_64",
          "python": "3.11.15",
          "release": "6.17.0-1018-azure",
          "system": "Linux",
          "toolchain": {
            "buildType": "Release",
            "cmake": "cmake version 3.31.6",
            "compiler": "c++ (Ubuntu 13.3.0-6ubuntu2~24.04.1) 13.3.0",
            "compilerPath": "/usr/bin/c++",
            "compilerTarget": "x86_64-linux-gnu",
            "cxxFlags": {
              "common": "",
              "configuration": "-O3 -DNDEBUG"
            },
            "deploymentTarget": "",
            "generator": "Ninja",
            "linker": "GNU ld (GNU Binutils for Ubuntu) 2.42",
            "linkerFlags": {
              "common": "",
              "configuration": ""
            },
            "linkerPath": "/usr/bin/ld",
            "sdkVersion": "",
            "sysroot": "",
            "systemName": "Linux",
            "systemProcessor": "x86_64"
          },
          "totalMemoryBytes": 16765386752
        },
        "threadConfig": "ort-intra-1/inter-1"
      },
      "medianUs": 3487938,
      "p95Us": 3706673,
      "reportDigests": [
        "5642ae126d24742bd140b076412fd6c49a80967154bb1d6beabbba2ce53ed342",
        "9a963b527a2f9eec822f090c2654b021dff3bac0ee7a31e9947afec0a9b89e01",
        "b4c17b219ca12c6cfd723a185ba4051c46e8b42763c3a51ddacc1a112866b136",
        "93a1be5c8e45e3cf401d36490608aa3207331219ad8eb81684fe91b8cd552ebd",
        "d7399db6e551757be7799e2b18ff771b81a88cd745e9d48a1be7aee25d997924"
      ],
      "resultHashes": [
        "d2900badabbac80ceb47a098b8b78f321df6ee6925d15cbee803592c31c21397",
        "1c21489a8cfee80349b48f04824d975c8859ae772364b5be2efd12e78d7768e8"
      ],
      "samples": 10
    },
    {
      "absolutePeakBytes": 745975808,
      "comparator": {
        "absolutePeakBytes": 663363584,
        "enforced": false,
        "identity": "same-runner-core",
        "medianUs": 3487938,
        "observedMedianRatio": 0.9860674128955274,
        "observedP95Ratio": 0.9925375127506527,
        "observedPeakOverheadBytes": 82612224,
        "p95Us": 3706673,
        "reason": "separate process baselines and non-interleaved samples"
      },
      "diagnosticsPeakBytes": {
        "off": 745975808,
        "on": 744431616
      },
      "inferenceOnlyMedianUs": 3325558,
      "key": {
        "bundleId": "ppocrv6-small-onnx-20260714.2",
        "contractVersion": "tiled-v1",
        "coreVersion": "0.2.0",
        "fixtureHash": "d5497796ca117c104d504d720d93b3cd8821f4700d7b384f7210334fe313236f",
        "fixtureId": "tiled-dense-2048",
        "implementation": "node",
        "nodeVersion": "v22.23.1",
        "packageVersion": "0.2.0",
        "pixelHash": "695d947c97b67687ee66e79c1d3433836422fce89a974e0a1d72fae62af38e8f",